Symbol,Name,Last Sale,Net Change,% Change,Market Cap,Country,IPO Year,Volume,Sector,Industry
A,Agilent Technologies Inc. Common Stock,$126.91,-0.09,-0.071%,38942273345.00,United States,1999,787057,Capital Goods,Biotechnology: Laboratory Analytical Instruments
AA,Alcoa Corporation Common Stock ,$19.385,-0.625,-3.123%,3604245025.00,,2016,8513262,Basic Industries,Aluminum
AAIC,Arlington Asset Investment Corp Class A (new),$3.83,-0.05,-1.289%,128028041.00,United States,,89204,Consumer Services,Real Estate Investment Trusts
AAIC.PRB,Arlington Asset Investment Corp,NA,,,,,,0,,
AAIC.PRC,Arlington Asset Investment Corp,NA,,,,,,0,,
AAN,Aarons Holdings Company Inc. Common Stock ,$20.50,0.31,1.535%,692459435.00,United States,2020,215752,Technology,Diversified Commercial Services
AAP,Advance Auto Parts Inc Advance Auto Parts Inc W/I,$163.61,-3.07,-1.842%,11101681126.00,United States,,390309,Consumer Services,Other Specialty Stores
AAT,American Assets Trust Inc. Common Stock,$28.95,-0.12,-0.413%,1750748094.00,United States,2011,73714,Consumer Services,Real Estate Investment Trusts
AB,AllianceBernstein Holding L.P.  Units,$35.995,0.385,1.081%,3461803575.00,United States,,253804,Finance,Investment Managers
ABB,ABB Ltd Common Stock,$30.465,0.305,1.011%,62721008500.00,Switzerland,,1470618,Consumer Durables,Electrical Products
ABBV,AbbVie Inc. Common Stock,$111.20,-0.06,-0.054%,196320700238.00,United States,2012,2669240,Health Care,Major Pharmaceuticals
ABC,AmerisourceBergen Corporation Common Stock,$108.04,3.13,2.984%,22115025994.00,United States,,994350,Health Care,Other Pharmaceuticals
ABEV,Ambev S.A. American Depositary Shares (Each representing 1 Common Share),$2.805,-0.135,-4.592%,44136435958.00,,2013,31659076,Consumer Non-Durables,Beverages (Production/Distribution)
ABG,Asbury Automotive Group Inc Common Stock,$162.07,-5.23,-3.126%,3125608764.00,United States,2002,111089,Consumer Durables,Automotive Aftermarket
ABM,ABM Industries Incorporated Common Stock,$39.61,0.50,1.278%,2644310919.00,United States,,156306,Finance,Diversified Commercial Services
ABR,Arbor Realty Trust Common Stock,$14.61,-0.04,-0.273%,1802802250.00,United States,2004,893043,Consumer Services,Real Estate Investment Trusts
ABR.PRA,Arbor Realty Trust,NA,,,,,,0,,
ABR.PRB,Arbor Realty Trust,NA,,,,,,0,,
ABR.PRC,Arbor Realty Trust,NA,,,,,,0,,
ABT,Abbott Laboratories Common Stock,$112.875,-0.075,-0.066%,200055313455.00,United States,,2604656,Health Care,Major Pharmaceuticals
AC,Associated Capital Group Inc. Common Stock,$35.23,0.57,1.645%,785810294.00,United States,2015,7285,Finance,Investment Bankers/Brokers/Service
ACA,Arcosa Inc. Common Stock ,$61.95,0.19,0.308%,2990163262.00,,2018,120332,Capital Goods,Metal Fabrications
ACB,Aurora Cannabis Inc. Common Shares,$10.66,-0.51,-4.566%,1957773472.00,,2018,26831634,Consumer Durables,Specialty Chemicals
ACC,American Campus Communities Inc Common Stock,$41.725,-0.635,-1.499%,5742698997.00,United States,2004,1344851,Consumer Services,Real Estate Investment Trusts
ACCO,Acco Brands Corporation Common Stock,$8.73,0.15,1.748%,824957387.00,United States,,206296,Consumer Durables,Publishing
ACEL,Accel Entertainment Inc. ,$10.29,-0.26,-2.464%,995895743.00,United States,2017,71563,Consumer Services,Services-Misc. Amusement & Recreation
ACH,Aluminum Corporation of China Limited American Depositary Shares,$8.42,-0.49,-5.499%,5733236250.00,China,2001,74270,Basic Industries,Aluminum
ACI,Albertsons Companies Inc. Class A Common Stock,$17.4801,0.1001,0.576%,8137567903.00,United States,2020,1718200,Consumer Services,Food Chains
ACIC,Atlas Crest Investment Corp. Class A Common Stock,$10.575,0.015,0.142%,680765625.00,United States,2020,353573,Finance,Business Services
ACIC.U,Atlas Crest Investment Corp. Units each consisting of one Class A common stock and one-third of one redeemable warrant,NA,,,,United States,2020,0,,
ACIC.WS,Atlas Crest Investment Corp. Redeemable warrants included as part of the units each whole warrant exercisable for one Class A common stock at an exercise price of $11.50,NA,,,,United States,,0,,
ACM,AECOM Common Stock,$53.79,0.31,0.58%,7948791269.00,United States,2007,335220,Consumer Services,Military/Government/Technical
ACN,Accenture plc Class A Ordinary Shares (Ireland),$255.50,-2.44,-0.946%,169054643300.00,Ireland,2001,1432783,Miscellaneous,Business Services
ACND,Ascendant Digital Acquisition Corp. Class A Ordinary Shares,$10.56,0.05,0.476%,546480000.00,United States,2020,68915,Finance,Business Services
ACND.U,Ascendant Digital Acquisition Corp. Units each consisting of one Class A ordinary share and one-half of one redeemable warrant,NA,,,,United States,2020,0,,
ACND.WS,Ascendant Digital Acquisition Corp. Warrants each whole warrant exercisable for one Class A ordinary share at an exercise price of $11.50 per share,NA,,,,United States,,0,,
ACP,Aberdeen Income Credit Strategies Fund Common Shares,$10.93,-0.12,-1.086%,190532809.00,United States,2011,102128,,
ACRE,Ares Commercial Real Estate Corporation Common Stock,$12.07,0.14,1.174%,403644180.00,United States,2012,105807,Consumer Services,Real Estate Investment Trusts
ACV,AllianzGI Diversified Income & Convertible Fund Common Shares of Beneficial Interest,$34.1164,0.0064,0.019%,353238476.00,United States,2015,28540,,
ADC,Agree Realty Corporation Common Stock,$64.675,0.515,0.803%,4075914413.00,United States,,153299,Consumer Services,Real Estate Investment Trusts
ADCT,ADC Therapeutics SA Common Shares,$33.19,1.44,4.535%,2546291927.00,,2020,152063,Health Care,Major Pharmaceuticals
ADEX.U,Adit EdTech Acquisition Corp. Units each consisting of one share of common stock and one-half of one redeemable warrant,NA,,,,,2021,0,,
ADM,Archer-Daniels-Midland Company Common Stock,$52.92,0.13,0.246%,29444108473.00,United States,,987206,Consumer Non-Durables,Packaged Foods
ADNT,Adient plc Ordinary Shares ,$35.32,0.07,0.199%,3316320857.00,,2016,540251,Capital Goods,Auto Parts:O.E.M.
ADS,Alliance Data Systems Corporation Common Stock,$70.80,-0.46,-0.646%,3513222307.00,United States,2001,683332,Miscellaneous,Business Services
ADT,ADT Inc. Common Stock,$9.015,-0.115,-1.26%,7441505907.00,United States,2018,1929181,Consumer Services,Diversified Commercial Services
ADX,Adams Diversified Equity Fund Inc.,$17.76,0.02,0.113%,1930216687.00,United States,,135823,,
AEB,AEGON N.V. Perp. Cap. Secs. Floating Rate (Netherlands),$25.27,0.02,0.079%,0.00,Netherlands,,13815,Finance,Life Insurance
AEE,Ameren Corporation Common Stock,$72.875,1.135,1.582%,18015208522.00,United States,,1011953,Public Utilities,Power Generation
AEFC,Aegon Funding Company LLC 5.10% Subordinated Notes due 2049,$26.16,0.15,0.577%,0.00,,2019,38234,Finance,Life Insurance
AEG,AEGON N.V. Common Stock,$4.235,-0.045,-1.051%,8590779553.00,Netherlands,,909785,Finance,Life Insurance
AEL,American Equity Investment Life Holding Company Common Stock,$29.855,-0.315,-1.044%,2962304904.00,United States,2003,231144,Finance,Life Insurance
AEL.PRA,American Equity Investment Life Holding Company,NA,,,,,,0,,
AEL.PRB,American Equity Investment Life Holding Company,NA,,,,,,0,,
AEM,Agnico Eagle Mines Limited Common Stock,$70.84,-0.05,-0.071%,17168100848.00,Canada,,677410,Basic Industries,Precious Metals
AENZ,Aenza S.A.A. American Depositary Shares,$2.3644,0.0244,1.043%,412312515.00,,2018,357255,Basic Industries,Military/Government/Technical
AEO,American Eagle Outfitters Inc. Common Stock,$24.18,0.25,1.045%,4018331731.00,United States,,10376242,Consumer Services,Clothing/Shoe/Accessory Stores
AER,AerCap Holdings N.V. Ordinary Shares,$41.2101,-1.0299,-2.438%,5347282997.00,Netherlands,2006,1508821,Technology,Diversified Commercial Services
AES,The AES Corporation Common Stock,$27.175,-0.105,-0.385%,18074938947.00,United States,,4260041,Basic Industries,Electric Utilities: Central
AFB,AllianceBernstein National Municipal Income Fund Inc,$14.12,-0.03,-0.212%,405878496.00,United States,2002,36347,,
AFC,Allied Capital Corporation Allied Capital Corporation 6.875% Notes due April 15 2047,$25.98,-0.1524,-0.583%,0.00,United States,,5398,,
AFG,American Financial Group Inc. Common Stock,$85.12,-1.10,-1.276%,7392180006.00,United States,,155848,Finance,Property-Casualty Insurers
AFGB,American Financial Group Inc. 5.875% Subordinated Debentures due 2059,$27.50,0.07,0.255%,0.00,United States,2019,9813,Finance,Property-Casualty Insurers
AFGC,American Financial Group Inc. 5.125% Subordinated Debentures due 2059,$27.135,0.11,0.407%,27082358.00,United States,2019,2516,Finance,Property-Casualty Insurers
AFGD,American Financial Group Inc. 5.625% Subordinated Debentures due 2060,$27.745,0.025,0.09%,0.00,United States,2020,4006,Finance,Property-Casualty Insurers
AFGE,American Financial Group Inc. 4.500% Subordinated Debentures due 2060,$27.01,0.00,0.00%,0.00,United States,2020,239,Finance,Property-Casualty Insurers
AFI,Armstrong Flooring Inc. Common Stock,$4.135,0.045,1.10%,89424428.00,,2016,68840,Consumer Non-Durables,Plastic Products
AFL,AFLAC Incorporated Common Stock,$46.59,0.27,0.583%,32726923965.00,United States,,1577054,Finance,Accident &Health Insurance
AFT,Apollo Senior Floating Rate Fund Inc. Common Stock,$14.55,-0.08,-0.547%,226588038.00,,2011,47622,,
AG,First Majestic Silver Corp. Ordinary Shares (Canada),$14.00,0.46,3.397%,3097327618.00,Canada,,14269056,Basic Industries,Precious Metals
AGCB,Altimeter Growth Corp. 2 Class A Ordinary Shares,$14.24,0.43,3.114%,816664000.00,,2021,570281,Finance,Business Services
AGCO,AGCO Corporation Common Stock,$114.56,-0.51,-0.443%,8580488095.00,United States,,457722,Capital Goods,Industrial Machinery/Components
AGD,Aberdeen Global Dynamic Dividend Fund,$10.8169,-0.0431,-0.397%,135747574.00,United States,2006,21665,,
AGI,Alamos Gold Inc. Class A Common Shares,$7.98,-0.11,-1.36%,3133966807.00,Canada,2015,1390804,Basic Industries,Precious Metals
AGM,Federal Agricultural Mortgage Corporation Common Stock,$79.26,-0.60,-0.751%,850934726.00,United States,,20324,Finance,Finance Companies
AGM.A,Federal Agricultural Mortgage Corporation Common Stock,NA,,,,,,0,,
AGM.PRC,Federal Agricultural Mortgage Corporation,NA,,,,,,0,,
AGM.PRD,Federal Agricultural Mortgage Corporation,NA,,,,,,0,,
AGM.PRE,Federal Agricultural Mortgage Corporation,NA,,,,,,0,,
AGM.PRF,Federal Agricultural Mortgage Corporation,NA,,,,,,0,,
AGO,Assured Guaranty Ltd. Common Stock,$36.33,-0.12,-0.329%,2935688519.00,Bermuda,2004,238200,Finance,Property-Casualty Insurers
AGO.PRB,Assured Guaranty Ltd.,NA,,,,,,0,,
AGO.PRE,Assured Guaranty Ltd.,NA,,,,,,0,,
AGO.PRF,Assured Guaranty Ltd.,NA,,,,,,0,,
AGR,Avangrid Inc. Common Stock,$46.455,0.615,1.342%,14377408214.00,United States,2015,259101,Public Utilities,Electric Utilities: Central
AGRO,Adecoagro S.A. Common Shares,$7.71,-0.05,-0.644%,904683567.00,Luxembourg,2011,212342,Consumer Non-Durables,Farming/Seeds/Milling
AGS,PlayAGS Inc. Common Stock,$5.845,-0.055,-0.932%,209050931.00,United States,2018,192341,Consumer Durables,Miscellaneous manufacturing industries
AGX,Argan Inc. Common Stock,$44.685,0.155,0.348%,701106265.00,United States,,37444,Basic Industries,Engineering & Construction
AHC,A.H. Belo Corporation (TX) Common Stock,$1.96,0.01,0.513%,41964429.00,United States,,35530,Consumer Services,Newspapers/Magazines
AHH,Armada Hoffler Properties Inc. Common Stock,$11.465,-0.145,-1.249%,903436577.00,United States,2013,126555,Finance,Real Estate
AHH.PRA,Armada Hoffler Properties Inc.,NA,,,,,,0,,
AHL.PRC,Aspen Insurance Holdings Limited,NA,,,,,,0,,
AHL.PRD,Aspen Insurance Holdings Limited,NA,,,,,,0,,
AHL.PRE,Aspen Insurance Holdings Limited,NA,,,,,,0,,
AHT,Ashford Hospitality Trust Inc Common Stock,$2.6807,0.0407,1.542%,142634278.00,United States,2003,3142937,Consumer Services,Real Estate Investment Trusts
AHT.PRD,Ashford Hospitality Trust Inc,NA,,,,,,0,,
AHT.PRF,Ashford Hospitality Trust Inc,NA,,,,,,0,,
AHT.PRG,Ashford Hospitality Trust Inc,NA,,,,,,0,,
AHT.PRH,Ashford Hospitality Trust Inc,NA,,,,,,0,,
AHT.PRI,Ashford Hospitality Trust Inc,NA,,,,,,0,,
AI,C3.ai Inc. Class A Common Stock,$126.79,-3.22,-2.477%,12152568174.00,,2020,3374611,Technology,Computer Software: Prepackaged Software
AIC,Arlington Asset Investment Corp 6.750% Notes due 2025,$24.75,0.029,0.117%,0.00,United States,2015,1984,Consumer Services,Real Estate Investment Trusts
AIF,Apollo Tactical Income Fund Inc. Common Stock,$14.39,-0.06,-0.415%,208137334.00,,2013,44780,,
AIG,American International Group Inc. New Common Stock,$40.27,-0.78,-1.90%,34693641308.00,United States,,2907996,Finance,Property-Casualty Insurers
AIG.PRA,American International Group Inc.,NA,,,,,,0,,
AIN,Albany International Corporation Common Stock,$76.33,0.01,0.013%,2465459000.00,United States,,59985,Basic Industries,Textiles
AIO,AllianzGI Artificial Intelligence & Technology Opportunities Fund Common Shares,$28.84,0.10,0.348%,989879213.00,,2019,133946,,
AIR,AAR Corp. Common Stock,$36.945,-0.075,-0.203%,1303875354.00,United States,,127618,Capital Goods,Aerospace
AIRC,Apartment Income REIT Corp. Common Stock,$39.00,-0.39,-0.99%,11874694221.00,,2020,687087,Consumer Services,Real Estate Investment Trusts
AIT,Applied Industrial Technologies Inc. Common Stock,$84.08,1.18,1.423%,3258940296.00,United States,,85288,Consumer Durables,Industrial Specialties
AIV,Apartment Investment and Management Company Common Stock,$4.795,0.025,0.524%,1459978431.00,United States,1994,3329125,Consumer Services,Real Estate Investment Trusts
AIW,Arlington Asset Investment Corp 6.625% Notes due 2023,$25.05,0.20,0.805%,0.00,United States,,2098,Consumer Services,Real Estate Investment Trusts
AIZ,Assurant Inc. Common Stock,$134.97,-2.74,-1.99%,7930728009.00,United States,2004,216503,Finance,Property-Casualty Insurers
AIZN,Assurant Inc. 5.25% Subordinated Notes due 2061,$26.56,-0.04,-0.15%,0.00,United States,2020,1246,Finance,Property-Casualty Insurers
AIZP,Assurant Inc. 6.50% Series D Mandatory Convertible Preferred Stock $1.00 par value,$127.81,-2.48,-1.903%,0.00,United States,,2459,Finance,Property-Casualty Insurers
AJAX,Ajax I Class A Ordinary Shares,$12.555,0.305,2.49%,1130984821.00,United States,2020,973555,Finance,Business Services
AJAX.U,Ajax I Units each consisting of one Class A ordinary share and one-fourth of one redeemable warrant,NA,,,,United States,2020,0,,
AJAX.WS,Ajax I Redeemable warrants each whole warrant exercisable for one Class A ordinary share at an exercise price of $11.50,NA,,,,United States,,0,,
AJG,Arthur J. Gallagher & Co. Common Stock,$118.22,-0.87,-0.731%,22736306840.00,United States,,323733,Finance,Specialty Insurers
AJRD,Aerojet Rocketdyne Holdings Inc. Common Stock,$52.505,-0.255,-0.483%,4015924680.00,United States,,1113216,Capital Goods,Military/Government/Technical
AJX,Great Ajax Corp. Common Stock,$10.64,0.01,0.094%,245086474.00,United States,2015,26799,Consumer Services,Real Estate Investment Trusts
AJXA,Great Ajax Corp. 7.25% Convertible Senior Notes due 2024,$24.77,-0.10,-0.402%,0.00,United States,2017,4848,Consumer Services,Real Estate Investment Trusts
AKO/A,Embotelladora Andina S.A.,$13.71,-0.56,-3.924%,,Chile,,1171,,
AKO/B,Embotelladora Andina S.A.,$16.24,-0.53,-3.16%,,Chile,,8855,,
AKR,Acadia Realty Trust Common Stock,$14.935,0.015,0.101%,1288414118.00,United States,,426214,Consumer Services,Real Estate Investment Trusts
AL,Air Lease Corporation Class A Common Stock,$42.53,-0.64,-1.483%,4839016872.00,United States,2011,452433,Technology,Diversified Commercial Services
AL.PRA,Air Lease Corporation,NA,,,,,,0,,
ALB,Albemarle Corporation Common Stock,$173.55,-2.86,-1.621%,18475645845.00,United States,,1550722,Basic Industries,Major Chemicals
ALC,Alcon Inc. Ordinary Shares,$74.095,0.785,1.071%,36247274000.00,Switzerland,2019,970279,Health Care,Ophthalmic Goods
ALE,Allete Inc.,$65.765,0.275,0.42%,3418128312.00,United States,,212027,Public Utilities,Power Generation
ALEX,Alexander & Baldwin Inc. Common Stock REIT Holding Company,$16.58,0.15,0.913%,1199635073.00,United States,,186185,Consumer Services,Real Estate Investment Trusts
ALG,Alamo Group Inc. Common Stock,$153.39,0.57,0.373%,1822172730.00,United States,,13178,Capital Goods,Industrial Machinery/Components
ALIN.PRA,Altera Infrastructure L.P.,NA,,,,,,0,,
ALIN.PRB,Altera Infrastructure L.P.,NA,,,,,,0,,
ALIN.PRE,Altera Infrastructure L.P.,NA,,,,,,0,,
ALK,Alaska Air Group Inc. Common Stock,$54.415,-0.545,-0.992%,6729164480.00,United States,,704048,Transportation,Air Freight/Delivery Services
ALL,Allstate Corporation (The) Common Stock,$110.84,0.12,0.108%,33702900002.00,United States,,639118,Finance,Property-Casualty Insurers
ALL.PRB,Allstate Corporation (The),NA,,,,,,0,,
ALL.PRG,Allstate Corporation (The),NA,,,,,,0,,
ALL.PRH,Allstate Corporation (The),NA,,,,,,0,,
ALL.PRI,Allstate Corporation (The),NA,,,,,,0,,
ALLE,Allegion plc Ordinary Shares,$113.97,-1.07,-0.93%,10489686540.00,United States,2013,378340,Consumer Services,Diversified Commercial Services
ALLY,Ally Financial Inc. Common Stock,$40.835,0.895,2.241%,15266461375.00,United States,2014,6510278,Finance,Major Banks
ALLY.PRA,Ally Financial Inc.,NA,,,,,,0,,
ALP.PRQ,Alabama Power Company,NA,,,,,,0,,
ALSN,Allison Transmission Holdings Inc. Common Stock,$44.70,0.65,1.476%,5036384849.00,United States,2012,524958,Capital Goods,Auto Parts:O.E.M.
ALTG,Alta Equipment Group Inc. Class A Common Stock,$10.26,0.16,1.584%,307989831.00,,2019,75308,Capital Goods,Industrial Machinery/Components
ALTG.PRA,Alta Equipment Group Inc.,NA,,,,,,0,,
ALTG.WS,Alta Equipment Group Inc. Warrants,NA,,,,,,0,,
ALUS,Alussa Energy Acquisition Corp. Class A Ordinary Shares,$10.47,0.07,0.673%,376265625.00,,2020,78004,Finance,Business Services
ALUS.U,Alussa Energy Acquisition Corp. Units each consisting of one Class A Ordinary Share and one-half of one redeemable warrant,NA,,,,,2019,0,,
ALUS.WS,Alussa Energy Acquisition Corp. Redeemable Warrants each whole warrant exercisable for one Ordinary Share at an exercise price of $11.50,NA,,,,,,0,,
ALV,Autoliv Inc. Common Stock,$88.61,-1.38,-1.534%,7738975964.00,Sweden,,283975,Capital Goods,Auto Parts:O.E.M.
ALX,Alexander's Inc. Common Stock,$274.49,-1.01,-0.367%,1401900032.00,United States,,5742,Consumer Services,Real Estate Investment Trusts
AM,Antero Midstream Corporation Common Stock,$8.115,0.015,0.185%,3867925501.00,United States,2017,5483116,Public Utilities,Natural Gas Distribution
AMBC,Ambac Financial Group Inc. Common Stock,$15.66,0.08,0.513%,717371117.00,United States,,195685,Finance,Property-Casualty Insurers
AMBC.WS,Ambac Financial Group Inc. Warrants,NA,,,,United States,,0,,
AMC,AMC Entertainment Holdings Inc. Class A Common Stock,$3.535,0.555,18.624%,763896924.00,,2013,250234317,Consumer Services,Movies/Entertainment
AMCR,Amcor plc Ordinary Shares,$11.125,-0.125,-1.111%,17449356899.00,,2019,4429487,Consumer Durables,Miscellaneous manufacturing industries
AME,AMETEK Inc.,$118.02,-1.46,-1.222%,27152254305.00,United States,,651615,Capital Goods,Industrial Machinery/Components
AMG,Affiliated Managers Group Inc. Common Stock,$113.09,0.48,0.426%,5129882162.00,United States,,137938,Finance,Investment Managers
AMH,American Homes 4 Rent Common Shares of Beneficial Interest,$31.21,-0.05,-0.16%,9870572662.00,,2013,872931,Consumer Services,Real Estate Investment Trusts
AMH.PRD,American Homes 4 Rent,NA,,,,,,0,,
AMH.PRE,American Homes 4 Rent,NA,,,,,,0,,
AMH.PRF,American Homes 4 Rent,NA,,,,,,0,,
AMH.PRG,American Homes 4 Rent,NA,,,,,,0,,
AMH.PRH,American Homes 4 Rent,NA,,,,,,0,,
AMK,AssetMark Financial Holdings Inc. Common Stock,$24.61,-0.21,-0.846%,1782976166.00,United States,2019,23834,Finance,Investment Managers
AMN,AMN Healthcare Services Inc AMN Healthcare Services Inc,$74.35,1.28,1.752%,3496742359.00,United States,,139942,Technology,Professional Services
AMOV,America Movil S.A.B. de C.V. Class A American Depositary Shares,$15.3599,0.0132,0.086%,51319008461.00,Mexico,,3822,Public Utilities,Telecommunications Equipment
AMP,Ameriprise Financial Inc. Common Stock,$212.33,0.39,0.184%,25050233493.00,United States,,273923,Finance,Investment Managers
AMPY,Amplify Energy Corp. Common Stock,$2.035,0.015,0.743%,76630878.00,United States,2016,1308120,Energy,Oil & Gas Production
AMRC,Ameresco Inc. Class A Common Stock,$59.02,-0.19,-0.321%,2825055747.00,United States,2010,169177,Basic Industries,Engineering & Construction
AMRX,Amneal Pharmaceuticals Inc. Class A Common Stock,$4.93,0.07,1.44%,727808209.00,,2018,915940,Health Care,Major Pharmaceuticals
AMT,American Tower Corporation (REIT) Common Stock,$224.17,1.97,0.887%,99579308911.00,United States,,1489275,Consumer Services,Real Estate Investment Trusts
AMWL,American Well Corporation Class A Common Stock,$29.465,0.305,1.046%,6922981015.00,United States,2020,2125327,Miscellaneous,Business Services
AMX,America Movil S.A.B. de C.V. American Depository Receipt Series L,$14.31,0.13,0.917%,47811184388.00,Mexico,,1900717,Public Utilities,Telecommunications Equipment
AN,AutoNation Inc. Common Stock,$76.21,-0.98,-1.27%,6696193327.00,United States,,212840,Consumer Durables,Automotive Aftermarket
ANET,Arista Networks Inc. Common Stock,$311.35,-0.31,-0.099%,23557196816.00,,2014,286568,Technology,Computer Communications Equipment
ANF,Abercrombie & Fitch Company Common Stock,$24.28,0.19,0.789%,1514845516.00,United States,,822585,Consumer Services,Clothing/Shoe/Accessory Stores
ANH,Anworth Mortgage Asset Corporation Common Stock,$2.63,0.00,0.00%,260989639.00,United States,,265168,Consumer Services,Real Estate Investment Trusts
ANH.PRA,Anworth Mortgage Asset  Corporation,NA,,,,,,0,,
ANH.PRB,Anworth Mortgage Asset  Corporation,NA,,,,,,0,,
ANH.PRC,Anworth Mortgage Asset  Corporation,NA,,,,,,0,,
ANTM,Anthem Inc. Common Stock,$315.57,-6.13,-1.906%,78483619107.00,United States,,589579,Health Care,Medical Specialities
AOD,Aberdeen Total Dynamic Dividend Fund Common Stock,$9.095,-0.045,-0.492%,958894936.00,United States,2007,257464,,
AON,Aon plc Class A Ordinary Shares (Ireland),$207.00,-2.47,-1.179%,47323584036.00,United States,,608236,Finance,Specialty Insurers
AONE,one Class A Ordinary Shares,$11.14,-0.07,-0.624%,299387500.00,United States,2020,124106,Finance,Business Services
AONE.U,one Units each consisting of one Class A Ordinary Share and one third of one Warrant to acquire one Class A Ordinary Share,NA,,,,United States,2020,0,,
AONE.WS,one Warrants each whole warrant exercisable for one Class A ordinary share at an exercise price of $11.50,NA,,,,United States,,0,,
AOS,A.O. Smith Corporation Common Stock,$57.975,-0.065,-0.112%,9361093734.00,United States,,508658,Consumer Durables,Consumer Electronics/Appliances
AP,Ampco-Pittsburgh Corporation Common Stock,$6.887,0.007,0.102%,126112953.00,United States,,62465,Capital Goods,Fluid Controls
APAM,Artisan Partners Asset Management Inc. Class A Common Stock,$52.65,-0.63,-1.182%,4136979015.00,United States,2013,304792,Finance,Investment Managers
APD,Air Products and Chemicals Inc. Common Stock,$285.06,2.45,0.867%,63012245899.00,United States,,548712,Basic Industries,Major Chemicals
APG,APi Group Corporation Common Stock,$18.54,0.09,0.488%,3346468813.00,,2020,340988,Basic Industries,Engineering & Construction
APH,Amphenol Corporation Common Stock,$132.53,-0.57,-0.428%,39646979150.00,United States,,539222,Capital Goods,Electrical Products
APLE,Apple Hospitality REIT Inc. Common Shares,$13.165,0.105,0.804%,2939296982.00,United States,2015,1427413,Consumer Services,Real Estate Investment Trusts
APO,Apollo Global Management Inc. Class A Common Stock,$46.83,-0.98,-2.05%,10715444991.00,United States,2011,615995,Finance,Investment Managers
APO.PRA,Apollo Global Management Inc,NA,,,,,,0,,
APO.PRB,Apollo Global Management Inc,NA,,,,,,0,,
APRN,Blue Apron Holdings Inc. Class A Common Stock,$7.40,0.27,3.787%,130874964.00,United States,2017,1361956,Consumer Services,Catalog/Specialty Distribution
APSG,Apollo Strategic Growth Capital Class A Ordinary Shares,$10.88,-0.02,-0.183%,1123289280.00,United States,2020,1116522,Finance,Business Services
APSG.U,Apollo Strategic Growth Capital Units each consisting of one Class A Ordinary Share and one-third Warrant,NA,,,,United States,2020,0,,
APSG.WS,Apollo Strategic Growth Capital Warrants each exercisable for one Class A Ordinary Share at an exercise price of $11.50 per share,NA,,,,United States,,0,,
APTS,Preferred Apartment Communities Inc. Common Stock,$7.50,-0.06,-0.794%,374254163.00,United States,2011,382466,Consumer Services,Real Estate Investment Trusts
APTV,Aptiv PLC Ordinary Shares,$139.9175,-3.9325,-2.734%,37781275267.00,United Kingdom,2011,1609083,Capital Goods,Auto Parts:O.E.M.
APTV.PRA,Aptiv PLC,NA,,,,,,0,,
AQN,Algonquin Power & Utilities Corp. Common Shares,$17.33,0.02,0.116%,10346552654.00,,2016,452021,Public Utilities,Electric Utilities: Central
AQNA,Algonquin Power & Utilities Corp. 6.875% Fixed-to-Floating Rate Subordinated Notes Series 2018-A due October 17 2078,$28.25,0.23,0.821%,0.00,,2018,8882,Public Utilities,Electric Utilities: Central
AQNB,Algonquin Power & Utilities Corp. 6.20% Fixed-to-Floating Subordinated Notes Series 2019-A due July 1 2079,$28.11,0.34,1.224%,0.00,,2019,7720,Public Utilities,Electric Utilities: Central
AQUA,Evoqua Water Technologies Corp. Common Stock,$30.44,0.13,0.429%,3608704068.00,United States,2017,517627,Technology,Industrial Machinery/Components
AR,Antero Resources Corporation Common Stock,$6.65,0.13,1.994%,1786668434.00,,2013,5156090,Energy,Oil & Gas Production
ARA,American Renal Associates Holdings Inc Common Stock,$11.48,-0.01,-0.087%,396557027.00,United States,2016,57422,Health Care,Misc Health and Biotechnology Services
ARC,ARC Document Solutions Inc. Common Stock,$1.91,-0.05,-2.551%,83778362.00,United States,2004,154156,Consumer Services,Professional Services
ARCH,Arch Resources Inc. Class A Common Stock,$50.97,0.48,0.951%,772057320.00,United States,2016,147552,Energy,Coal Mining
