Symbol,Name,Last Sale,Net Change,% Change,Market Cap,Country,IPO Year,Volume,Sector,Industry
DDF,Delaware Investments Dividend & Income Fund Inc. Common Stock,$9.56,-0.07,-0.727%,73498790.00,United States,1993,9089,,
DDS,Dillard's Inc. Common Stock,$79.63,2.68,3.483%,1751692140.00,United States,,843859,Consumer Services,Department/Specialty Retail Stores
DDT,Dillard's Capital Trust I,$25.49,0.152,0.60%,0.00,United States,,25814,Consumer Services,Department/Specialty Retail Stores
DE,Deere & Company Common Stock,$306.36,0.86,0.282%,96326122948.00,United States,,988027,Capital Goods,Industrial Machinery/Components
DEA,Easterly Government Properties Inc. Common Stock,$22.91,-0.22,-0.951%,1861010572.00,United States,2015,436135,Consumer Services,Real Estate Investment Trusts
DECK,Deckers Outdoor Corporation Common Stock,$318.54,-4.46,-1.381%,8945896472.00,United States,1993,186165,Consumer Non-Durables,Shoe Manufacturing
DEH,D8 Holdings Corp. Class A Ordinary Shares,$10.29,-0.03,-0.291%,443756250.00,Hong Kong,2020,62092,Finance,Business Services
DEH.U,D8 Holdings Corp. Units each consisting of one Class A ordinary share and one-half of one redeemable warrant,NA,,,,Hong Kong,2020,0,,
DEH.WS,D8 Holdings Corp. Warrants each whole warrant exercisable for one Class A ordinary share at an exercise price of $11.50 per share,NA,,,,Hong Kong,,0,,
DEI,Douglas Emmett Inc. Common Stock,$28.46,-0.46,-1.591%,4991169256.00,United States,2006,452245,Consumer Services,Real Estate Investment Trusts
DELL,Dell Technologies Inc. Class C Common Stock ,$76.09,-0.81,-1.053%,57052615122.00,,2018,873233,Technology,Computer Manufacturing
DEN,Denbury Inc. Common Stock,$30.965,1.785,6.117%,1548249969.00,,2020,493116,Energy,Oil & Gas Production
DEO,Diageo plc Common Stock,$158.975,-1.565,-0.975%,92978538353.00,United Kingdom,,160533,Consumer Non-Durables,Beverages (Production/Distribution)
DESP,Despegar.com Corp. Ordinary Shares,$11.04,-0.36,-3.158%,772203840.00,,2017,223855,Consumer Services,Transportation Services
DEX,Delaware Enhanced Global Dividend Common Shares of Beneficial Interest,$9.80,-0.01,-0.102%,117671893.00,United States,2007,23689,,
DFIN,Donnelley Financial Solutions Inc. Common Stock ,$18.92,-0.35,-1.816%,631462000.00,,2016,93951,Consumer Services,Other Consumer Services
DFNS,LGL Systems Acquisition Corp. Common Stock,$10.80,-0.04,-0.369%,232875000.00,United States,2020,245222,Finance,Business Services
DFNS.U,LGL Systems Acquisition Corp. Units,NA,,,,United States,2020,0,,
DFNS.WS,LGL Systems Acquisition Corp. Redeemable Warrants each whole warrant exercisable for shares of Class A Common Stock at an exercise price of $11.50 per share,NA,,,,United States,,0,,
DFP,Flaherty & Crumrine Dynamic Preferred and Income Fund Inc. Common Stock,$29.0852,-0.0748,-0.257%,557614445.00,,2013,35748,,
DFS,Discover Financial Services Common Stock,$92.81,-1.43,-1.517%,28445924573.00,United States,,2200347,Finance,Finance: Consumer Services
DG,Dollar General Corporation Common Stock,$206.6977,-1.0223,-0.492%,50641123148.00,United States,2009,1001154,Consumer Services,Department/Specialty Retail Stores
DGNR,Dragoneer Growth Opportunities Corp. Class A Ordinary Shares,$14.38,-0.17,-1.168%,1240275000.00,United States,2020,125860,Finance,Business Services
DGNR.U,Dragoneer Growth Opportunities Corp. Units each consisting of one Class A ordinary share and one-fourth of one redeemable warrant,NA,,,,United States,2020,0,,
DGNR.WS,Dragoneer Growth Opportunities Corp. Redeemable warrants each whole warrant exercisable for one Class A ordinary share at an exercise price of $11.50,NA,,,,United States,,0,,
DGX,Quest Diagnostics Incorporated Common Stock,$124.20,-0.98,-0.783%,16737935213.00,United States,,743877,Health Care,Medical Specialities
DHF,BNY Mellon High Yield Strategies Fund Common Stock,$2.99,0.00,0.00%,217395987.00,United States,1998,1130226,,
DHI,D.R. Horton Inc. Common Stock,$77.51,0.94,1.228%,28262240708.00,United States,,2510562,Capital Goods,Homebuilding
DHR,Danaher Corporation Common Stock,$237.27,4.17,1.789%,168551261595.00,United States,,1714075,Capital Goods,Industrial Machinery/Components
DHR.PRA,Danaher Corporation,NA,,,,,,0,,
DHR.PRB,Danaher Corporation,NA,,,,,,0,,
DHT,DHT Holdings Inc.,$5.485,-0.015,-0.273%,936828829.00,Jersey,2005,1772110,Transportation,Marine Transportation
DHX,DHI Group Inc. Common Stock,$2.49,0.09,3.75%,130568892.00,United States,2007,73006,Miscellaneous,Business Services
DIAX,Nuveen Dow 30SM Dynamic Overwrite Fund Common Shares of Beneficial Interest,$15.08,-0.06,-0.396%,548413048.00,,2014,85663,,
DIN,Dine Brands Global Inc. Common Stock,$74.08,0.84,1.147%,1216300926.00,United States,,174924,Consumer Services,Restaurants
DIS,Walt Disney Company (The) Common Stock,$173.38,2.10,1.226%,314557059031.00,United States,,7170730,Consumer Services,Services-Misc. Amusement & Recreation
DK,Delek US Holdings Inc. Common Stock,$20.75,0.21,1.022%,1529809479.00,United States,2017,545621,Energy,Integrated oil Companies
DKL,Delek Logistics Partners L.P. Common Units representing Limited Partner Interests,$37.72,0.44,1.18%,1638301775.00,United States,2012,22279,Energy,Natural Gas Distribution
DKS,Dick's Sporting Goods Inc Common Stock,$67.935,0.155,0.229%,6086885986.00,United States,2002,824631,Consumer Services,Other Specialty Stores
DL,China Distance Education Holdings Limited American Depositary Shares,$9.6089,-0.0011,-0.011%,328498503.00,China,,2241,Consumer Services,Other Consumer Services
DLB,Dolby Laboratories Common Stock,$94.29,0.09,0.096%,9517142386.00,United States,2005,138340,Miscellaneous,Multi-Sector Companies
DLNG,Dynagas LNG Partners LP Common Units,$2.71,0.04,1.498%,96510092.00,Greece,,87873,Consumer Services,Marine Transportation
DLNG.PRA,Dynagas LNG Partners LP,NA,,,,,,0,,
DLNG.PRB,Dynagas LNG Partners LP,NA,,,,,,0,,
DLR,Digital Realty Trust Inc. Common Stock,$140.66,-0.56,-0.397%,39408034641.00,United States,2004,785860,Consumer Services,Real Estate Investment Trusts
DLR.PRC,Digital Realty Trust Inc.,NA,,,,,,0,,
DLR.PRJ,Digital Realty Trust Inc.,NA,,,,,,0,,
DLR.PRK,Digital Realty Trust Inc.,NA,,,,,,0,,
DLR.PRL,Digital Realty Trust Inc.,NA,,,,,,0,,
DLX,Deluxe Corporation Common Stock,$33.95,0.73,2.197%,1422300893.00,United States,,160689,Consumer Durables,Publishing
DLY,DoubleLine Yield Opportunities Fund Common Shares of Beneficial Interest,$19.0101,-0.0699,-0.366%,0.00,,2020,173600,,
DM,Desktop Metal Inc. Class A Common Stock,$25.2704,1.2504,5.206%,5728925552.00,,2019,3088915,Technology,Industrial Machinery/Components
DM.WS,Desktop Metal Inc. Warrants,NA,,,,,,0,,
DMB,BNY Mellon Municipal Bond Infrastructure Fund Inc. Common Stock,$14.4515,0.0015,0.01%,265728011.00,,2013,22640,,
DMO,Western Asset Mortgage Opportunity Fund Inc. Common Stock,$14.16,0.04,0.283%,155534544.00,United States,2010,20867,,
DMS,Digital Media Solutions Inc. Class A Ordinary Shares,$10.82,-0.48,-4.248%,631801884.00,United States,2018,50472,Miscellaneous,Business Services
DMS.WS,Digital Media Solutions Inc. Warrants ,NA,,,,United States,,0,,
DMYD,dMY Technology Group Inc. II Class A Common Stock,$20.24,-0.38,-1.843%,698280000.00,United States,2020,994476,Finance,Business Services
DMYD.U,dMY Technology Group Inc. II Units each consisting of one share of Class A common stock and one-third of one redeemable warrant,NA,,,,United States,2020,0,,
DMYD.WS,dMY Technology Group Inc. II Redeemable Warrants,NA,,,,United States,,0,,
DMYI,dMY Technology Group Inc. III Class A Common Stock,$11.9801,0.4801,4.175%,454120666.00,United States,2021,468884,Finance,Business Services
DMYI.U,dMY Technology Group Inc. III Units each consisting of one share of Class A common stock and one-fourth of one redeemable warrant,NA,,,,United States,2020,0,,
DMYI.WS,dMY Technology Group Inc. III Redeemable warrants each whole warrant exercisable for one share of Class A common stock each at an exercise price of $11.50 per share,NA,,,,United States,,0,,
DNB,Dun & Bradstreet Holdings Inc. Common Stock,$24.725,-0.255,-1.021%,10459641476.00,United States,2020,666279,Finance,Finance: Consumer Services
DNK,Phoenix Tree Holdings Limited American Depositary Shares each representing ten (10) Class A ordinary shares,$2.87,-0.02,-0.692%,524865600.00,,2020,104967,Consumer Services,Building operators
DNMR,Danimer Scientific Inc. Common Stock,$39.58,1.62,4.268%,3392978481.00,,2020,4460319,Basic Industries,Major Chemicals
DNMR.WS,Danimer Scientific Inc. Redeemable Warrants,NA,,,,,,0,,
DNOW,NOW Inc. Common Stock,$8.175,0.035,0.43%,894178451.00,,2014,529864,Energy,Metal Fabrications
DNP,DNP Select Income Fund Inc. Common Stock,$10.35,0.02,0.194%,3188132235.00,United States,1987,422029,,
DOC,Physicians Realty Trust Common Shares of Beneficial Interest,$18.155,0.035,0.193%,3780411148.00,United States,2013,585145,Consumer Services,Real Estate Investment Trusts
DOOR,Masonite International Corporation Ordinary Shares (Canada),$108.42,0.64,0.594%,2656611682.00,Canada,,57624,Basic Industries,Forest Products
DOV,Dover Corporation Common Stock,$125.75,0.77,0.616%,18120989849.00,United States,,338153,Technology,Industrial Machinery/Components
DOW,Dow Inc. Common Stock ,$57.615,0.055,0.096%,42736027768.00,,2019,1487395,Basic Industries,Major Chemicals
DPG,Duff & Phelps Utility and Infrastructure Fund Inc.,$13.01,0.01,0.077%,493466776.00,United States,2011,227897,,
DPZ,Domino's Pizza Inc Common Stock,$380.88,-0.24,-0.063%,15006636197.00,United States,2004,267044,Consumer Non-Durables,Food Distributors
DQ,DAQO New Energy Corp. American Depositary Shares each representing five ordinary shares,$96.03,1.56,1.651%,6672532195.00,China,2010,2251175,Technology,Semiconductors
DRD,DRDGOLD Limited American Depositary Shares,$10.64,-0.17,-1.573%,909841073.00,South Africa,,191999,Basic Industries,Precious Metals
DRE,Duke Realty Corporation Common Stock,$40.05,0.04,0.10%,14896644399.00,United States,,914075,Consumer Services,Real Estate Investment Trusts
DRH,Diamondrock Hospitality Company Common Stock,$8.845,0.015,0.17%,1764744494.00,United States,2005,1322044,Consumer Services,Real Estate Investment Trusts
DRH.PRA,Diamondrock Hospitality Company,NA,,,,,,0,,
DRI,Darden Restaurants Inc. Common Stock,$122.73,-2.23,-1.785%,15995175936.00,United States,,705739,Consumer Services,Restaurants
DRQ,Dril-Quip Inc. Common Stock,$32.48,0.42,1.31%,1139911422.00,United States,1997,92153,Energy,Metal Fabrications
DRUA,Dominion Energy Inc. 2016 Series A 5.25% Enhanced Junior Subordinated Notes due 2076,$26.017,0.057,0.22%,0.00,United States,2016,74898,Public Utilities,Electric Utilities: Central
DS,Drive Shack Inc.,$2.425,-0.025,-1.02%,163027764.00,United States,,1144341,Consumer Services,Restaurants
DS.PRB,Drive Shack Inc.,NA,,,,,,0,,
DS.PRC,Drive Shack Inc.,NA,,,,,,0,,
DS.PRD,Drive Shack Inc.,NA,,,,,,0,,
DSE,Duff & Phelps Select MLP and Midstream Energy Fund Inc.,$5.38,-0.10,-1.825%,14113645.00,United States,2014,5959,,
DSL,DoubleLine Income Solutions Fund Common Shares of Beneficial Interests,$16.57,-0.17,-1.016%,1689425966.00,,2013,814842,,
DSM,BNY Mellon Strategic Municipal Bond Fund Inc. Common Stock,$7.80,-0.02,-0.256%,385487786.00,United States,1989,65620,,
DSSI,Diamond S Shipping Inc. Common Stock ,$6.81,0.07,1.039%,275400438.00,,2019,132931,Consumer Services,Transportation Services
DSU,Blackrock Debt Strategies Fund Inc. Common Stock,$10.66,-0.04,-0.374%,498709381.00,United States,1998,142301,,
DSX,Diana Shipping inc. common stock,$2.42,0.00,0.00%,216045505.00,Greece,2005,298947,Transportation,Marine Transportation
DSX.PRB,Diana Shipping inc.,NA,,,,,,0,,
DT,Dynatrace Inc. Common Stock,$45.26,-0.75,-1.63%,12767688269.00,United States,2019,1457592,Technology,Computer Software: Prepackaged Software
DTB,DTE Energy Company 2020 Series G 4.375% Junior Subordinated Debentures due 2080,$25.27,0.05,0.198%,0.00,United States,2020,45318,Public Utilities,Electric Utilities: Central
DTE,DTE Energy Company Common Stock,$122.065,-0.465,-0.379%,23626851720.00,United States,,592926,Public Utilities,Electric Utilities: Central
DTF,DTF Tax-Free Income Inc. Common Stock,$14.3853,0.1052,0.737%,101122416.00,United States,1991,80558,,
DTJ,DTE Energy Company 2016 Series B 5.375% Junior Subordinated Debentures due 2076,$25.74,0.04,0.156%,0.00,United States,2016,12812,Public Utilities,Electric Utilities: Central
DTLA.PR,Brookfield DTLA Inc.,NA,,,,,,0,,
DTP,DTE Energy Company 6.25% Corporate Units,$47.27,0.07,0.148%,0.00,United States,,73748,Public Utilities,Electric Utilities: Central
DTW,DTE Energy Company 2017 Series E 5.25% Junior Subordinated Debentures due 2077,$26.12,-0.05,-0.191%,0.00,United States,2017,35809,Public Utilities,Electric Utilities: Central
DTY,DTE Energy Company 2016 Series F 6.00% Junior Subordinated Debentures due 2076,$26.4257,0.1257,0.478%,0.00,United States,2016,6715,Public Utilities,Electric Utilities: Central
DUC,Duff & Phelps Utility & Corporate Bond Trust Inc. Common Stock,$9.89,0.00,0.00%,271922415.00,United States,1993,29175,,
DUK,Duke Energy Corporation (Holding Company) Common Stock,$90.46,0.28,0.31%,66574811338.00,United States,,993946,Public Utilities,Power Generation
DUK.PRA,Duke Energy Corporation,NA,,,,,,0,,
DUKB,Duke Energy Corporation 5.625% Junior Subordinated Debentures due 2078,$27.755,-0.035,-0.126%,0.00,United States,2018,41016,Public Utilities,Power Generation
DUKH,Duke Energy Corporation 5.125% Junior Subordinated Debentures due 2073,$25.979,-0.061,-0.234%,0.00,United States,,11962,Public Utilities,Power Generation
DVA,DaVita Inc. Common Stock,$119.68,0.36,0.302%,13398592606.00,United States,,210864,Health Care,Misc Health and Biotechnology Services
DVD,Dover Motorsports Inc. Common Stock,$2.39,-0.03,-1.24%,86929993.00,United States,1996,66308,Consumer Services,Services-Misc. Amusement & Recreation
DVN,Devon Energy Corporation Common Stock,$17.82,-0.57,-3.10%,11982091285.00,United States,,13693398,Energy,Oil & Gas Production
DWIN.U,Delwinds Insurance Acquisition Corp. Units each consisting of one share of Class A common stock and one-half of one redeemable warrant,NA,,,,,2020,0,,
DX,Dynex Capital Inc. Common Stock,$18.36,-0.24,-1.29%,424934966.00,United States,,283064,Consumer Services,Real Estate Investment Trusts
DX.PRB,Dynex Capital Inc.,NA,,,,,,0,,
DX.PRC,Dynex Capital Inc.,NA,,,,,,0,,
DXC,DXC Technology Company Common Stock ,$29.255,-0.045,-0.154%,7442827682.00,,,1716509,Technology,EDP Services
DY,Dycom Industries Inc. Common Stock,$89.40,0.32,0.359%,2853038560.00,United States,,94863,Basic Industries,Water Supply
DYFN,Angel Oak Dynamic Financial Strategies Income Term Trust Common Shares of Beneficial Interest,$18.44,-0.18,-0.967%,0.00,,2020,15298,,
E,ENI S.p.A. Common Stock,$20.87,-0.24,-1.137%,36981213918.00,Italy,,657644,Energy,Oil & Gas Production
EAF,GrafTech International Ltd. Common Stock,$10.58,-0.27,-2.488%,2826889181.00,United States,2018,823345,Energy,Industrial Machinery/Components
EAI,Entergy Arkansas LLC First Mortgage Bonds 4.875% Series Due September 1 2066,$26.19,0.29,1.12%,0.00,United States,2016,33181,Public Utilities,Electric Utilities: Central
EARN,Ellington Residential Mortgage REIT Common Shares of Beneficial Interest,$12.275,-0.165,-1.326%,151407657.00,United States,2013,32108,Consumer Services,Real Estate Investment Trusts
EAT,Brinker International Inc. Common Stock,$62.77,0.95,1.537%,2842818463.00,United States,,773065,Consumer Services,Restaurants
EB,Eventbrite Inc. Class A Common Stock,$19.36,0.75,4.03%,1774263153.00,United States,2018,413976,Technology,Computer Software: Programming Data Processing
EBF,Ennis Inc. Common Stock,$18.645,0.055,0.296%,486066629.00,United States,,54028,Consumer Services,Office Equipment/Supplies/Services
EBR,Centrais Electricas Brasileiras S A American Depositary Shares (Each representing one Common Share),$5.59,-0.29,-4.932%,8770323787.00,,2016,1982000,Public Utilities,Electric Utilities: Central
EBR.B,Centrais Electricas Brasileiras S.A.- Eletrobr?!s American Depositary Shares (Each representing one Preferred Share),NA,,,,,2016,0,,
EBS,Emergent Biosolutions Inc. Common Stock,$106.90,-3.16,-2.871%,5665607959.00,United States,2006,307042,Health Care,Major Pharmaceuticals
EC,Ecopetrol S.A. American Depositary Shares,$13.45,-0.42,-3.028%,27650977172.00,Colombia,,627972,Energy,Oil & Gas Production
ECC           ,Eagle Point Credit Company Inc. Common Stock,$11.24,0.14,1.261%,356033002.00,United States,2014,102038,,
ECCB,Eagle Point Credit Company Inc. 7.75% Series B Term Preferred Stock due 2026,$25.17,0.09,0.359%,0.00,United States,2016,39398,,
ECCX,Eagle Point Credit Company Inc. 6.6875% Notes due 2028,$25.085,0.125,0.501%,0.00,United States,2018,5847,,
ECCY,Eagle Point Credit Company Inc. 6.75% Notes due 2027,$25.245,0.085,0.338%,0.00,United States,2017,1806,,
ECL,Ecolab Inc. Common Stock,$212.825,-1.185,-0.554%,60749871072.00,United States,,523014,Basic Industries,Package Goods/Cosmetics
ECOM          ,ChannelAdvisor Corporation Common Stock,$19.84,0.33,1.691%,575362976.00,United States,2013,159124,Technology,Computer Software: Prepackaged Software
ED,Consolidated Edison Inc. Common Stock,$69.01,-0.14,-0.202%,23112533009.00,United States,,1540045,Public Utilities,Power Generation
EDD,Morgan Stanley Emerging Markets Domestic Debt Fund Inc. Morgan Stanley Emerging Markets Domestic Debt Fund Inc. Common Stock,$6.20,-0.05,-0.80%,409771175.00,United States,2007,617762,,
EDF,Stone Harbor Emerging Markets Income Fund Common Shares of Beneficial Interest,$7.958,-0.112,-1.388%,131960272.00,United States,2010,70580,,
EDI,Stone Harbor Emerging Markets Total Income Fund Common Shares of Beneficial Interests,$8.65,-0.24,-2.70%,85260957.00,United States,2012,62891,,
EDN,Empresa Distribuidora Y Comercializadora Norte S.A. (Edenor) Empresa Distribuidora Y Comercializadora Norte S.A. (Edenor) American Depositary Shares,$3.492,0.062,1.808%,152787959.00,Argentina,2007,10939,Public Utilities,Electric Utilities: Central
EDU,New Oriental Education & Technology Group Inc. Sponsored ADR representing 1 Ordinary Share (Cayman Islands),$168.875,-14.015,-7.663%,28736764167.00,China,2006,3069450,Consumer Services,Other Consumer Services
EEA,The European Equity Fund Inc. Common Stock,$10.60,-0.05,-0.469%,79025470.00,United States,,3377,,
EEX,Emerald Holding Inc. Common Stock,$4.39,-0.08,-1.79%,313624585.00,United States,2017,154847,Miscellaneous,Business Services
EFC,Ellington Financial Inc. Common Stock ,$15.70,-0.09,-0.57%,687372439.00,United States,2010,125965,Finance,Real Estate
EFC.PRA,Ellington Financial Inc.,NA,,,,,,0,,
EFF,Eaton vance Floating-Rate Income Plus Fund Common Shares of Beneficial Interest,$15.56,-0.06,-0.384%,118355926.00,,2013,13047,,
EFL,Eaton Vance Floating-Rate 2022 Target Term Trust Common Shares of Beneficial Interest,$9.105,-0.035,-0.383%,215074777.00,United States,2017,54422,,
EFR,Eaton Vance Senior Floating-Rate Fund Common Shares of Beneficial Interest,$13.415,-0.115,-0.85%,494320119.00,United States,2003,49892,,
EFT,Eaton Vance Floating Rate Income Trust Common Shares of Beneficial Interest,$13.75,-0.09,-0.65%,529734563.00,United States,2004,79323,,
EFX,Equifax Inc. Common Stock,$179.375,0.885,0.496%,21819705053.00,United States,,280564,Finance,Finance: Consumer Services
EGF,Blackrock Enhanced Government Fund Inc. Common Stock,$12.9801,-0.2099,-1.591%,55314553.00,United States,2005,22881,,
EGHT,8x8 Inc Common Stock,$37.315,0.395,1.07%,3967384459.00,United States,,1092038,Technology,EDP Services
EGO,Eldorado Gold Corporation Ordinary Shares,$11.16,-0.15,-1.326%,1950755412.00,Canada,,1826752,Basic Industries,Precious Metals
EGP,EastGroup Properties Inc. Common Stock,$139.57,1.07,0.773%,5520960720.00,United States,,105292,Consumer Services,Real Estate Investment Trusts
EGY,VAALCO Energy Inc.  Common Stock,$2.33,0.04,1.747%,133872804.00,United States,,234037,Energy,Oil & Gas Production
EHC,Encompass Health Corporation Common Stock,$87.44,-0.06,-0.069%,8694374652.00,United States,,344241,Health Care,Hospital/Nursing Management
EHI,Western Asset Global High Income Fund Inc Common Stock,$10.25,0.06,0.589%,449641639.00,United States,2003,20456,,
EHT,Eaton Vance 2021 Target Term Trust Common Shares of Beneficial Interest,$9.78,-0.02,-0.204%,209922849.00,United States,2016,61211,,
EIC,Eagle Point Income Company Inc. Common Stock,$15.125,-0.0465,-0.306%,0.00,,2019,880,,
EIG,Employers Holdings Inc Common Stock,$32.30,-0.22,-0.677%,945453139.00,United States,2007,68070,Finance,Property-Casualty Insurers
EIX,Edison International Common Stock,$59.32,-0.01,-0.017%,22453445260.00,United States,,1205329,Public Utilities,Electric Utilities: Central
EL,Estee Lauder Companies Inc. (The) Common Stock,$250.48,-4.79,-1.876%,90574981709.00,United States,1995,593325,Consumer Non-Durables,Package Goods/Cosmetics
ELAN,Elanco Animal Health Incorporated Common Stock,$30.53,0.14,0.461%,14407566507.00,United States,2018,1424101,Health Care,Major Pharmaceuticals
ELAT,Elanco Animal Health Incorporated 5.00% Tangible Equity Units,$48.31,0.53,1.109%,0.00,United States,2020,354,Health Care,Major Pharmaceuticals
ELC,Entergy Louisiana Inc. Collateral Trust Mortgage Bonds 4.875 % Series due September 1 2066,$26.60,0.2632,0.999%,0.00,United States,2016,4387,Public Utilities,Electric Utilities: Central
ELF,e.l.f. Beauty Inc. Common Stock,$22.68,-0.60,-2.577%,1157435471.00,United States,2016,751495,Consumer Non-Durables,Package Goods/Cosmetics
ELP,Companhia Paranaense de Energia (COPEL) Common Stock,$12.07,-0.41,-3.285%,3303020376.00,Brazil,,793765,Public Utilities,Electric Utilities: Central
ELS,Equity Lifestyle Properties Inc. Common Stock,$63.35,1.45,2.342%,11543934935.00,United States,,1103654,Consumer Services,Real Estate Investment Trusts
ELVT,Elevate Credit Inc. Common Stock,$4.125,-0.125,-2.941%,157040507.00,United States,2017,495562,Finance,Finance: Consumer Services
ELY,Callaway Golf Company Common Stock,$28.9499,0.3399,1.188%,2726488468.00,United States,1992,789143,Consumer Non-Durables,Recreational Products/Toys
EMD,Western Asset Emerging Markets Debt Fund Inc Common Stock,$13.665,-0.025,-0.183%,830094254.00,United States,,106714,,
EME,EMCOR Group Inc. Common Stock,$96.75,1.90,2.003%,5314537195.00,United States,,151955,Capital Goods,Engineering & Construction
EMF,Templeton Emerging Markets Fund Common Stock,$20.36,-0.24,-1.165%,329232255.00,United States,1987,121675,,
EMN,Eastman Chemical Company Common Stock,$106.79,0.87,0.821%,14466616400.00,United States,,543280,Basic Industries,Major Chemicals
EMO,ClearBridge Energy Midstream Opportunity Fund Inc. Common Stock,$15.31,-0.16,-1.034%,219588222.00,United States,2011,42914,,
EMP,Entergy Mississippi LLC First Mortgage Bonds 4.90% Series Due October 1 2066,$26.54,0.222,0.844%,0.00,United States,2016,7363,Public Utilities,Electric Utilities: Central
EMPW,Empower Ltd. Class A Ordinary Shares,$10.21,0.02,0.196%,328634375.00,United States,2020,64547,Finance,Business Services
EMPW.U,Empower Ltd. Units each consisting of one Class A ordinary share $0.0001 par value and one-third of one redeemable warrant,NA,,,,United States,2020,0,,
EMPW.WS,Empower Ltd. Redeemable Warrants each whole warrant exercisable for one Class A ordinary share at an exercise price of $11.50,NA,,,,United States,,0,,
EMR,Emerson Electric Company Common Stock,$84.14,-0.12,-0.142%,50439289434.00,United States,,1493516,Energy,Consumer Electronics/Appliances
ENB,Enbridge Inc Common Stock,$34.69,-0.36,-1.027%,70254849295.00,Canada,,2564621,Energy,Natural Gas Distribution
ENBA,Enbridge Inc 6.375% Fixed-to-Floating Rate Subordinated Notes Series 2018-B due 2078,$27.055,0.215,0.801%,0.00,Canada,2018,32573,Energy,Natural Gas Distribution
ENBL,Enable Midstream Partners LP Common Units representing limited partner interests,$5.52,-0.06,-1.075%,2403821812.00,,2014,779324,Public Utilities,Natural Gas Distribution
ENIA,Enel Americas S.A. American Depositary Shares,$7.825,-0.055,-0.698%,11907507672.00,Chile,,1298491,Public Utilities,Electric Utilities: Central
ENIC,Enel Chile S.A. American Depositary Shares (Each representing 50 shares of Common Stock),$3.985,-0.165,-3.976%,5512574609.00,,2016,271771,Public Utilities,Electric Utilities: Central
ENJ,Entergy New Orleans LLC First Mortgage Bonds 5.0% Series due December 1 2052,$25.87,-0.05,-0.193%,0.00,United States,,778,Public Utilities,Power Generation
ENLC,EnLink Midstream LLC Common Units representing Limited Partner Interests,$3.985,0.125,3.238%,1953338241.00,,,1503534,Public Utilities,Natural Gas Distribution
ENO,Entergy New Orleans LLC First Mortgage Bonds 5.50% Series due April 1 2066,$25.74,0.12,0.468%,0.00,United States,2016,7310,Public Utilities,Power Generation
ENPC,Executive Network Partnering Corporation Class A Common Stock,$25.72,0.04,0.156%,456622592.00,,2020,43642,Finance,Business Services
ENPC.U,Executive Network Partnering Corporation Units each consisting of one share of Class A common stock and one-quarter of one redeemable warrant,NA,,,,,2020,0,,
ENPC.WS,Executive Network Partnering Corporation Warrants each whole warrant exercisable for one share of Class A common stock at an exercise price of $28.75,NA,,,,,,0,,
ENR,Energizer Holdings Inc. Common Stock,$48.07,0.25,0.523%,3294543835.00,United States,2015,151741,Miscellaneous,Industrial Machinery/Components
ENR.PRA,Energizer Holdings Inc.,NA,,,,,,0,,
ENS,EnerSys Common Stock,$93.20,0.83,0.899%,3968202962.00,United States,2004,177934,Miscellaneous,Industrial Machinery/Components
ENV,Envestnet Inc Common Stock,$82.84,-3.57,-4.131%,4469201101.00,United States,2010,285151,Miscellaneous,Business Services
ENVA,Enova International Inc. Common Stock,$24.28,-0.39,-1.581%,865973272.00,United States,2014,282306,Finance,Finance: Consumer Services
