Symbol,Name,Last Sale,Net Change,% Change,Market Cap,Country,IPO Year,Volume,Sector,Industry
JEMD,Nuveen Emerging Markets Debt 2022 Target Term Fund Common Shares of Beneficial Interest $0.01 par value per share,$7.67,-0.03,-0.39%,109261167.00,,2017,35386,,
JEQ,Aberdeen Japan Equity Fund Inc.  Common Stock,$9.47,-0.0783,-0.82%,126978836.00,United States,1992,6275,,
JFR,Nuveen Floating Rate Income Fund Common Stock,$9.27,-0.01,-0.108%,527634198.00,United States,2004,1243688,,
JGH,Nuveen Global High Income Fund Common Shares of Beneficial Interest,$15.27,0.06,0.394%,353918791.00,United States,2014,22902,,
JHAA,Nuveen Corporate Income 2023 Target Term Fund,$9.76,-0.12,-1.215%,76366378.00,,2018,2900,,
JHB,Nuveen Corporate Income November 2021 Target Term Fund,$9.2663,-0.0037,-0.04%,517986624.00,,2016,131658,,
JHG,Janus Henderson Group plc Ordinary Shares,$33.62,-0.37,-1.089%,6098860743.00,,2017,305931,Finance,Investment Managers
JHI,John Hancock Investors Trust Common Stock,$17.5898,0.02,0.114%,153154828.00,United States,,5360,,
JHS,John Hancock Income Securities Trust Common Stock,$15.37,-0.03,-0.195%,179007996.00,United States,,13797,,
JHX,James Hardie Industries plc American Depositary Shares (Ireland),$29.14,-0.08,-0.274%,12943040629.00,Ireland,,7345,Capital Goods,Building Materials
JIH,Juniper Industrial Holdings Inc. Class A Common Stock,$12.435,0.365,3.024%,536259375.00,,2019,1160560,Finance,Business Services
JIH.U,Juniper Industrial Holdings Inc. Units each consisting of one share of Class A common stock $0.0001 par value per share and one-half of one warrant,NA,,,,,2019,0,,
JIH.WS,Juniper Industrial Holdings Inc. Redeemable warrants included as part of the units,NA,,,,,,0,,
JILL,J. Jill Inc. Common Stock,$3.99,0.16,4.178%,38383202.00,,2017,110869,Consumer Non-Durables,Apparel
JKS,JinkoSolar Holding Company Limited American Depositary Shares (each representing 4 Common Shares),$68.00,-0.35,-0.512%,3079981732.00,China,2010,2096988,Technology,Semiconductors
JLL,Jones Lang LaSalle Incorporated Common Stock,$160.53,6.20,4.017%,8235654376.00,United States,,195633,Finance,Real Estate
JLS,Nuveen Mortgage and Income Fund,$19.75,0.00,0.00%,108376940.00,United States,2009,15968,,
JMIA,Jumia Technologies AG American Depositary Shares each representing two Ordinary Shares,$56.52,10.95,24.029%,5041394036.00,,2019,24090126,Consumer Services,Catalog/Specialty Distribution
JMM,Nuveen Multi-Market Income Fund (MA),$7.06,-0.01,-0.141%,66804191.00,United States,,8662,,
JMP,JMP Group LLC Common Shares,$4.10,0.005,0.122%,80630383.00,United States,2007,10481,Finance,Investment Bankers/Brokers/Service
JNJ,Johnson & Johnson Common Stock,$164.10,2.37,1.465%,432000252475.00,United States,,5869859,Health Care,Major Pharmaceuticals
JNPR,Juniper Networks Inc. Common Stock,$25.035,-0.215,-0.851%,8254950123.00,United States,1999,3418090,Technology,Computer Communications Equipment
JOE,St. Joe Company (The) Common Stock,$44.785,-2.255,-4.794%,2637054957.00,United States,,525137,Consumer Services,Homebuilding
JOF,Japan Smaller Capitalization Fund Inc Common Stock,$9.13,0.01,0.11%,258688443.00,United States,1990,14355,,
JP,Jupai Holdings Limited American Depositary Shares each representing six ordinary shares,$1.96,-0.02,-1.01%,66080061.00,,2015,52478,Consumer Services,Other Consumer Services
JPC,Nuveen Preferred & Income Opportunities Fund,$9.19,0.00,0.00%,949833819.00,United States,2003,173226,,
JPI,Nuveen Preferred and Income Term Fund Common Shares of Beneficial Interest,$24.10,-0.11,-0.454%,548549523.00,,2012,55687,,
JPM,JP Morgan Chase & Co. Common Stock,$134.27,-0.56,-0.415%,409442938000.00,United States,,10368224,Finance,Major Banks
JPM.PRC,J P Morgan Chase & Co,NA,,,,,,0,,
JPM.PRD,J P Morgan Chase & Co,NA,,,,,,0,,
JPM.PRG,J P Morgan Chase & Co,NA,,,,,,0,,
JPM.PRH,J P Morgan Chase & Co,NA,,,,,,0,,
JPM.PRJ,J P Morgan Chase & Co,NA,,,,,,0,,
JPS,Nuveen Preferred & Income Securities Fund,$9.345,0.005,0.054%,1904322866.00,United States,2002,301991,,
JPT,Nuveen Preferred and Income 2022 Term Fund Common Shares of Beneficial Interest,$24.335,-0.18,-0.734%,166431445.00,United States,2017,578,,
JQC,Nuveen Credit Strategies Income Fund Shares of Beneficial Interest,$6.445,-0.015,-0.232%,874001874.00,United States,2003,932231,,
JRI,Nuveen Real Asset Income and Growth Fund Common Shares of Beneficial Interest,$13.489,-0.091,-0.67%,370531769.00,United States,2012,96757,,
JRO,Nuveen Floating Rate Income Opportuntiy Fund Shares of Beneficial Interest,$9.165,-0.045,-0.489%,371560263.00,United States,2004,851677,,
JRS,Nuveen Real Estate Income Fund Common Shares of Beneficial Interest,$8.55,0.10,1.183%,247030627.00,United States,2001,95944,,
JSD,Nuveen Short Duration Credit Opportunities Fund Common Shares of Beneficial Interest,$13.65,0.02,0.147%,137669095.00,United States,2011,41051,,
JT,Jianpu Technology Inc. American depositary shares,$3.16,0.15,4.983%,66784031.00,,2017,205735,Technology,Computer Software: Programming Data Processing
JTA,Nuveen Tax-Advantaged Total Return Strategy Fund Common Share of Beneficial Interest,$9.845,-0.055,-0.556%,136362081.00,United States,2004,13324,,
JTD,Nuveen Tax-Advantaged Dividend Growth Fund Common Shares of Beneficial Interest,$14.27,-0.12,-0.834%,206691532.00,United States,,49677,,
JW/A,John Wiley & Sons Inc.,$48.53,0.45,0.936%,,United States,,208700,,
JW/B,John Wiley & Sons Inc.,$48.21,1.52,3.256%,,United States,,304,,
JWN,Nordstrom Inc. Common Stock,$37.0677,0.8277,2.284%,5844965340.00,United States,,1909278,Consumer Services,Clothing/Shoe/Accessory Stores
JWS,Jaws Acquisition Corp. Class A Ordinary Shares,$14.70,-0.60,-3.922%,1267875000.00,,2020,1303016,Finance,Business Services
JWS.U,Jaws Acquisition Corp. Units each consisting of one Class A ordinary share and one-third of one redeemable warrant,NA,,,,,2020,0,,
JWS.WS,Jaws Acquisition Corp. Redeemable Warrants each whole warrant exercisable for one Class A ordinary share at an exercise price of $11.50,NA,,,,,,0,,
K,Kellogg Company Common Stock,$58.43,0.54,0.933%,20083149188.00,United States,,1486169,Consumer Non-Durables,Packaged Foods
KAI,Kadant Inc Common Stock,$151.53,2.26,1.514%,1744043627.00,United States,,20163,Technology,Industrial Machinery/Components
KAMN,Kaman Corporation Common Stock,$56.10,0.67,1.209%,1552701747.00,United States,,35014,Capital Goods,Military/Government/Technical
KAR,KAR Auction Services Inc Common Stock,$18.46,-0.13,-0.699%,2385983650.00,United States,2009,937586,Consumer Durables,Automotive Aftermarket
KB,KB Financial Group Inc,$39.90,-0.90,-2.206%,15745909967.00,South Korea,,81271,Finance,Commercial Banks
KBH,KB Home Common Stock,$41.98,0.79,1.918%,4108233075.00,United States,1986,2220855,Capital Goods,Homebuilding
KBR,KBR Inc. Common Stock,$30.565,-0.365,-1.18%,4356339375.00,United States,2006,854081,Basic Industries,Military/Government/Technical
KEN,Kenon Holdings Ltd. Ordinary Shares,$30.68,-0.12,-0.39%,1652767158.00,Singapore,2015,960,Public Utilities,Electric Utilities: Central
KEP,Korea Electric Power Corporation Common Stock,$10.955,-0.315,-2.795%,14065432927.00,South Korea,1994,68498,Public Utilities,Electric Utilities: Central
KEX,Kirby Corporation Common Stock,$52.675,-1.045,-1.945%,3162554325.00,United States,,254260,Consumer Services,Marine Transportation
KEY,KeyCorp Common Stock,$18.21,0.06,0.331%,17781565245.00,United States,,4428350,Finance,Major Banks
KEY.PRI,KeyCorp,NA,,,,,,0,,
KEY.PRJ,KeyCorp,NA,,,,,,0,,
KEY.PRK,KeyCorp,NA,,,,,,0,,
KEYS,Keysight Technologies Inc. Common Stock,$145.515,-1.165,-0.794%,27079476559.00,United States,2014,806131,Capital Goods,Industrial Machinery/Components
KF,Korea Fund Inc. (The) New Common Stock,$44.265,-0.625,-1.392%,222706909.00,United States,,7785,,
KFS,Kingsway Financial Services Inc. Common Stock (DE),$4.75,-0.11,-2.263%,107877578.00,Canada,,3800,Finance,Property-Casualty Insurers
KFY,Korn Ferry Common Stock,$47.80,-0.38,-0.789%,2578232194.00,United States,1999,130777,Technology,Diversified Commercial Services
KGC,Kinross Gold Corporation Common Stock,$7.035,-0.095,-1.332%,8852140500.00,Canada,,10853361,Basic Industries,Precious Metals
KIM,Kimco Realty Corporation Common Stock,$16.705,0.125,0.754%,7224890149.00,United States,,4272833,Consumer Services,Real Estate Investment Trusts
KIM.PRL,Kimco Realty Corporation,NA,,,,,,0,,
KIM.PRM,Kimco Realty Corporation,NA,,,,,,0,,
KIO,KKR Income Opportunities Fund Common Shares,$14.665,-0.015,-0.102%,298290719.00,,2013,44053,,
KKR,KKR & Co. Inc. Common Stock,$40.4028,-0.7372,-1.792%,22996833208.00,United States,,1096190,Finance,Investment Managers
KKR.PRA,KKR & Co. Inc.,NA,,,,,,0,,
KKR.PRB,KKR & Co. Inc.,NA,,,,,,0,,
KKR.PRC,KKR & Co. Inc.,NA,,,,,,0,,
KL,Kirkland Lake Gold Ltd. Common Shares,$40.195,-0.455,-1.119%,10733020717.00,,,1345614,Basic Industries,Precious Metals
KMB,Kimberly-Clark Corporation Common Stock,$132.38,1.37,1.046%,45027298332.00,United States,,1648883,Consumer Durables,Containers/Packaging
KMF,Kayne Anderson NextGen Energy & Infrastructure Inc.,$6.2954,-0.0046,-0.073%,297126902.00,,2010,174239,,
KMI,Kinder Morgan Inc. Common Stock,$15.35,0.09,0.59%,34745272765.00,United States,2011,13168889,Public Utilities,Natural Gas Distribution
KMPR,Kemper Corporation,$74.83,-0.57,-0.756%,4894511769.00,United States,,85685,Finance,Property-Casualty Insurers
KMT,Kennametal Inc. Common Stock,$40.41,1.09,2.772%,3365184453.00,United States,,262163,Capital Goods,Industrial Machinery/Components
KMX,CarMax Inc,$118.66,-1.63,-1.355%,19287168576.00,United States,,908176,Consumer Durables,Automotive Aftermarket
KN,Knowles Corporation Common Stock,$19.83,-0.05,-0.252%,1817890998.00,,2014,400488,Consumer Non-Durables,Consumer Electronics/Appliances
KNL,Knoll Inc. Common Stock,$16.175,0.155,0.968%,819782207.00,United States,2004,80546,Consumer Durables,Office Equipment/Supplies/Services
KNOP,KNOT Offshore Partners LP Common Units representing Limited Partner Interests,$17.14,-0.18,-1.039%,560376771.00,United Kingdom,2013,137298,Consumer Services,Marine Transportation
KNX,Knight-Swift Transportation Holdings Inc.,$43.82,0.30,0.689%,7442017951.00,United States,2017,969549,Transportation,Trucking Freight/Courier Services
KO,Coca-Cola Company (The) Common Stock,$48.635,-0.315,-0.644%,209005732355.00,United States,,10457198,Consumer Non-Durables,Beverages (Production/Distribution)
KODK,Eastman Kodak Company Common New,$9.43,0.24,2.612%,727650164.00,United States,,8857670,Miscellaneous,Industrial Machinery/Components
KOF,Coca Cola Femsa S.A.B. de C.V.  American Depositary Shares each representing 10 Units (each Unit consists of 3 Series B Shares and 5 Series L Shares),$46.23,-0.14,-0.302%,9712147538.00,Mexico,1993,107789,Consumer Non-Durables,Beverages (Production/Distribution)
KOP,Koppers Holdings Inc. Koppers Holdings Inc. Common Stock,$35.52,0.26,0.737%,748243612.00,United States,2006,92354,Basic Industries,Forest Products
KOS,Kosmos Energy Ltd. Common Shares (DE),$2.675,0.125,4.902%,1084592253.00,Bermuda,2011,5579837,Energy,Oil & Gas Production
KR,Kroger Company (The) Common Stock,$33.535,0.325,0.979%,25531773657.00,United States,,4739898,Consumer Services,Food Chains
KRA,Kraton Corporation Common Stock,$31.30,0.11,0.353%,997590314.00,United States,2009,149856,Basic Industries,Major Chemicals
KRC,Kilroy Realty Corporation Common Stock,$58.01,-1.40,-2.357%,6685718399.00,United States,1997,724208,Consumer Services,Real Estate Investment Trusts
KREF,KKR Real Estate Finance Trust Inc. Common Stock,$17.81,-0.10,-0.558%,990582013.00,United States,2017,78287,Consumer Services,Real Estate Investment Trusts
KRG,Kite Realty Group Trust Common Stock,$16.74,0.36,2.198%,1409567728.00,United States,2004,186218,Consumer Services,Real Estate Investment Trusts
KRO,Kronos Worldwide Inc Common Stock,$15.335,0.195,1.288%,1771847565.00,United States,,59074,Basic Industries,Major Chemicals
KRP,Kimbell Royalty Partners Common Units Representing Limited Partner Interests,$8.775,-0.075,-0.847%,527220936.00,United States,2017,131333,Energy,Oil & Gas Production
KSM,DWS Strategic Municipal Income Trust,$11.622,0.062,0.536%,130212202.00,United States,1989,15767,,
KSS,Kohl's Corporation Common Stock,$45.03,0.24,0.536%,7099087347.00,United States,1992,2668358,Consumer Services,Department/Specialty Retail Stores
KSU,Kansas City Southern Common Stock,$218.27,5.28,2.479%,20430410100.00,United States,,1545693,Transportation,Railroads
KSU.PR,Kansas City Southern,NA,,,,,,0,,
KT,KT Corporation Common Stock,$10.77,-0.04,-0.37%,5213587480.00,South Korea,,438785,Public Utilities,Telecommunications Equipment
KTB,Kontoor Brands Inc. Common Stock ,$41.54,-0.26,-0.622%,2376311070.00,,2019,217560,Consumer Non-Durables,Apparel
KTF,DWS Municipal Income Trust,$11.525,-0.075,-0.647%,455248310.00,United States,1988,69921,,
KTH,Structures Products Cp 8% CorTS Issued by Peco Energy Cap Tr II Preferred Stock,$33.26,-0.22,-0.657%,0.00,United States,,2514,Finance,Finance: Consumer Services
KTN,Structured Products Corp 8.205% CorTS 8.205% Corporate Backed Trust Securities (CorTS),$32.60,0.06,0.184%,0.00,United States,,125,Finance,Finance: Consumer Services
KUKE,Kuke Music Holding Limited American Depositary Shares each representing one Ordinary Share,$9.34,-0.02,-0.214%,276153193.00,,2021,79880,Consumer Services,Other Consumer Services
KW,Kennedy-Wilson Holdings Inc. Common Stock,$17.71,0.03,0.17%,2510031181.00,United States,,218650,Finance,Real Estate
KWAC.U,Kingswood Acquisition Corp. Units each consisting of one share of Class A Common Stock and three-fourths of one redeemable warrant,NA,,,,,2020,0,,
KWR,Quaker Chemical Corporation Common Stock,$273.74,4.68,1.739%,4881215614.00,United States,,36294,Basic Industries,Major Chemicals
KYN,Kayne Anderson Energy Infrastructure Fund Inc.,$6.525,-0.095,-1.435%,825070290.00,United States,2004,1425928,,
L,Loews Corporation Common Stock,$46.575,0.045,0.097%,12802204013.00,United States,,344665,Finance,Property-Casualty Insurers
LAC,Lithium Americas Corp. Common Shares,$23.11,0.18,0.785%,2436154216.00,Canada,,7674594,Basic Industries,Precious Metals
LAD,Lithia Motors Inc. Common Stock,$337.52,6.99,2.115%,8952478698.00,United States,,281207,Consumer Durables,Automotive Aftermarket
LADR,Ladder Capital Corp Class A Common Stock,$10.435,0.055,0.53%,1296730914.00,,2014,499131,Consumer Services,Real Estate Investment Trusts
LAIX,LAIX Inc. American Depositary Shares each  representing one Class A Ordinary Share,$1.82,0.05,2.825%,89930264.00,,2018,785545,Consumer Services,Other Consumer Services
LAZ,Lazard LTD. Lazard LTD. Class A Common Stock,$43.46,0.18,0.416%,4564689112.00,Bermuda,2005,342929,Finance,Investment Managers
LB,L Brands Inc.,$45.152,-0.748,-1.63%,12557157837.00,United States,,2152997,Consumer Services,Clothing/Shoe/Accessory Stores
LBRT,Liberty Oilfield Services Inc. Class A Common Stock,$12.46,0.43,3.574%,2233577370.00,United States,2018,378319,Energy,Oilfield Services/Equipment
LC,LendingClub Corporation Common Stock,$11.725,0.165,1.427%,917278337.00,United States,2014,747768,Finance,Finance: Consumer Services
LCI,Lannett Co Inc Common Stock,$6.75,0.15,2.273%,281477005.00,United States,,167183,Health Care,Major Pharmaceuticals
LCII,LCI Industries,$141.30,-1.34,-0.939%,3554286058.00,United States,,32710,Capital Goods,Auto Parts:O.E.M.
LDL,Lydall Inc. Common Stock,$33.10,0.24,0.73%,586976500.00,United States,,34414,Capital Goods,Auto Parts:O.E.M.
LDOS,Leidos Holdings Inc. Common Stock,$112.3455,3.0355,2.777%,15989121771.00,United States,,468030,Technology,EDP Services
LDP,Cohen & Steers Limited Duration Preferred and Income Fund Inc.,$25.83,0.03,0.116%,746752326.00,United States,2012,30172,,
LEA,Lear Corporation Common Stock,$167.125,-0.785,-0.468%,10033981776.00,United States,,143711,Capital Goods,Auto Parts:O.E.M.
LEAF,Leaf Group Ltd. Common Stock,$5.46,0.15,2.825%,188561449.00,United States,,102114,Technology,EDP Services
LEAP,Ribbit LEAP Ltd. Class A Ordinary Shares,$14.76,-0.33,-2.187%,863533800.00,United States,2020,153108,Finance,Business Services
LEAP.U,Ribbit LEAP Ltd. Units each consisting of one Class A Ordinary Share and one fifth of one Warrant to acquire one Class A Ordinary Share,NA,,,,United States,2020,0,,
LEAP.WS,Ribbit LEAP Ltd. Warrants each whole warrant exercisable for one Class A Ordinary Share at an exercise price of $11.50,NA,,,,United States,,0,,
LEE,Lee Enterprises Incorporated Common Stock,$1.39,-0.02,-1.418%,81682699.00,United States,,165341,Consumer Services,Newspapers/Magazines
LEG,Leggett & Platt Incorporated Common Stock,$44.14,-0.49,-1.098%,5849384908.00,United States,,704862,Consumer Durables,Home Furnishings
LEJU,Leju Holdings Limited American Depositary Shares each representing one Ordinary share,$2.54,0.00,0.00%,346211368.00,,2014,122340,Finance,Real Estate
LEN,Lennar Corporation Class A Common Stock,$84.43,0.83,0.993%,26404377565.00,United States,,1678127,Basic Industries,Homebuilding
LEN.B,Lennar Corporation Class B,NA,,,,United States,,0,Basic Industries,Homebuilding
LEO,BNY Mellon Strategic Municipals Inc. Common Stock,$8.4046,0.0646,0.775%,522848166.00,United States,1987,161603,,
LEVI,Levi Strauss & Co Class A Common Stock,$20.67,-0.18,-0.863%,8209764487.00,United States,2019,686748,Consumer Non-Durables,Apparel
LFC,China Life Insurance Company Limited American Depositary Shares,$11.32,-0.44,-3.741%,63991303440.00,China,2003,261496,Finance,Life Insurance
LFT,Lument Finance Trust Inc. Common Stock,$3.25,-0.04,-1.216%,81065995.00,United States,2013,17884,Consumer Services,Real Estate Investment Trusts
LGF.A,Lions Gate Entertainment Corporation Class A Voting Shares,NA,,,,,,0,,
LGF.B,Lions Gate Entertainment Corporation Class B Non-Voting Shares,NA,,,,Canada,2016,0,,
LGI,Lazard Global Total Return and Income Fund Common Stock,$18.71,0.01,0.053%,243410757.00,United States,2004,32812,,
LGVW,Longview Acquisition Corp. Class A Common Stock,$21.3499,-0.7701,-3.481%,1104857325.00,,2020,1218364,Health Care,Medical Electronics
LGVW.U,Longview Acquisition Corp. Units each consisting of one share of Class A common stock and one-third of one warrant,NA,,,,,2020,0,,
LGVW.WS,Longview Acquisition Corp. Redeemable Warrants each whole warrant exercisable for one share of Class A common stock each at an exercise price of $11.50 per share,NA,,,,,,0,,
LH,Laboratory Corporation of America Holdings Common Stock,$228.69,0.24,0.105%,22274406000.00,United States,,271973,Health Care,Medical Specialities
LHC.U,Leo Holdings Corp. II Units each consisting of one Class A ordinary share and one-third of one redeemable warrant,NA,,,,,2021,0,,
LHX,L3Harris Technologies Inc. Common Stock,$184.4084,1.2784,0.698%,38746424564.00,United States,,767243,Capital Goods,Industrial Machinery/Components
LII,Lennox International Inc. Common Stock,$293.42,-0.08,-0.027%,11234875455.00,United States,1999,144457,Capital Goods,Industrial Machinery/Components
LIN,Linde plc Ordinary Share,$252.165,-1.035,-0.409%,132350487486.00,,2018,994950,Basic Industries,Major Chemicals
LINX,Linx S.A. American Depositary Shares each representing one common share,$6.92,0.03,0.435%,1215797103.00,,2019,20424,Technology,Computer Software: Prepackaged Software
LITB,LightInTheBox Holding Co. Ltd. American Depositary Shares each representing 2 ordinary shares,$2.614,0.064,2.51%,292181356.00,China,2013,285771,Consumer Services,Catalog/Specialty Distribution
LL,Lumber Liquidators Holdings Inc Common Stock,$29.69,-3.75,-11.214%,857290110.00,United States,2007,1412776,Consumer Services,RETAIL: Building Materials
LLY,Eli Lilly and Company Common Stock,$206.00,3.65,1.804%,197055809188.00,United States,,4277711,Health Care,Major Pharmaceuticals
LMND,Lemonade Inc. Common Stock,$153.3461,5.1561,3.479%,8677936919.00,United States,2020,2583801,Finance,Property-Casualty Insurers
LMT,Lockheed Martin Corporation Common Stock,$341.54,1.87,0.551%,95557340950.00,United States,,1108880,Capital Goods,Military/Government/Technical
LNC,Lincoln National Corporation Common Stock,$50.915,-0.295,-0.576%,9840105295.00,United States,,492998,Finance,Life Insurance
LND,Brasilagro Brazilian Agric Real Estate Co Sponsored ADR (Brazil),$4.91,-0.21,-4.102%,290588162.00,Brazil,,69950,Consumer Non-Durables,Farming/Seeds/Milling
LNFA,L&amp;F Acquisition Corp. Class A Ordinary Shares,$10.30,-0.04,-0.387%,0.00,United States,2021,35357,Finance,Business Services
LNFA.U,L&amp;F Acquisition Corp. Units each consisting of one Class A ordinary share and one-half of one redeemable warrant,NA,,,,United States,2020,0,,
LNFA.WS,L&amp;F Acquisition Corp. Warrants each whole warrant exercisable for one Class A ordinary share at an exercise price of $11.50,NA,,,,United States,,0,,
LNN,Lindsay Corporation Common Stock,$150.60,1.82,1.223%,1636306048.00,United States,,61045,Capital Goods,Industrial Machinery/Components
LOKB.U,Live Oak Acquisition Corp. II Units each consisting of one share of Class A common stock and one-third of one redeemable warrant,NA,,,,,2020,0,,
LOMA,Loma Negra Compania Industrial Argentina Sociedad Anonima ADS,$5.1619,-0.0681,-1.302%,615325322.00,Argentina,2017,52194,Capital Goods,Building Materials
LOW,Lowe's Companies Inc. Common Stock,$173.015,0.675,0.392%,130107280000.00,United States,,2411829,Consumer Services,RETAIL: Building Materials
LPG,Dorian LPG Ltd. Common Stock,$12.62,-0.13,-1.02%,642129439.00,,2014,586683,Transportation,Marine Transportation
LPI,Laredo Petroleum Inc. Common Stock,$25.06,0.71,2.916%,300815378.00,United States,2011,361897,Energy,Oil & Gas Production
LPL,LG Display Co Ltd AMERICAN DEPOSITORY SHARES,$10.565,-0.035,-0.33%,7560645741.00,South Korea,2004,672478,Capital Goods,Industrial Machinery/Components
LPX,Louisiana-Pacific Corporation Common Stock,$40.045,0.525,1.328%,4377872412.00,United States,,777141,Basic Industries,Forest Products
LRN,Stride Inc. Common Stock,$24.675,-0.045,-0.182%,1024904526.00,United States,,414637,Consumer Services,Other Consumer Services
LSI,Life Storage Inc. Common Stock,$122.30,1.14,0.941%,6050745170.00,United States,,187400,Consumer Services,Real Estate Investment Trusts
LSPD,Lightspeed POS Inc. Subordinate Voting Shares,$68.685,-1.655,-2.353%,8091554151.00,,,569736,Technology,Computer Software: Prepackaged Software
LTC,LTC Properties Inc. Common Stock,$39.885,0.275,0.694%,1565176144.00,United States,,75577,Consumer Services,Real Estate Investment Trusts
LTHM,Livent Corporation Common Stock,$21.495,-0.085,-0.394%,3144772603.00,United States,2018,2284076,Basic Industries,Major Chemicals
LU,Lufax Holding Ltd American Depositary Shares two of which representing one Ordinary Share,$15.44,-0.44,-2.771%,37644974116.00,China,2020,6613832,Finance,Finance: Consumer Services
LUB,Luby's Inc. Common Stock,$2.8499,-0.0001,-0.004%,87431424.00,United States,,7698,Consumer Services,Restaurants
LUMN,Lumen Technologies Inc. Common Stock,$11.165,0.075,0.676%,12249470183.00,United States,,4828031,Public Utilities,Telecommunications Equipment
LUV,Southwest Airlines Company Common Stock,$47.545,-0.225,-0.471%,28074102353.00,United States,,3729556,Transportation,Air Freight/Delivery Services
LVS,Las Vegas Sands Corp. Common Stock,$54.27,-1.11,-2.004%,41452952452.00,United States,2004,4028420,Consumer Services,Hotels/Resorts
LW,Lamb Weston Holdings Inc. Common Stock ,$78.26,1.19,1.544%,11453748717.00,,2016,482754,Consumer Non-Durables,Packaged Foods
LXP,Lexington Realty Trust Common Stock,$10.445,0.195,1.902%,2892769009.00,United States,,1026442,,
LXP.PRC,Lexington Realty Trust,NA,,,,,,0,,
LXU,LSB Industries Inc. Common Stock,$3.64,-0.07,-1.887%,106714492.00,United States,,155982,Basic Industries,Major Chemicals
LYB,LyondellBasell Industries NV Ordinary Shares Class A (Netherlands),$91.59,-1.03,-1.112%,30583647163.00,Netherlands,,1002622,Basic Industries,Major Chemicals
LYG,Lloyds Banking Group Plc American Depositary Shares,$1.86,-0.04,-2.105%,32940230818.00,United Kingdom,,3505385,Finance,Commercial Banks
LYV,Live Nation Entertainment Inc. Common Stock,$72.47,-2.12,-2.842%,15466336512.00,United States,,1209191,Consumer Services,Services-Misc. Amusement & Recreation
LZB,La-Z-Boy Incorporated Common Stock,$43.925,0.535,1.233%,2026883238.00,United States,,130396,Consumer Durables,Home Furnishings
M,Macy's Inc Common Stock,$12.86,0.54,4.383%,3992745910.00,United States,,15449778,Consumer Services,Department/Specialty Retail Stores
MA,Mastercard Incorporated Common Stock,$330.2699,-4.1701,-1.247%,329254434991.00,United States,2006,2801921,Miscellaneous,Business Services
MAA,Mid-America Apartment Communities Inc. Common Stock,$134.27,0.82,0.614%,15356434657.00,United States,1994,312110,Consumer Services,Real Estate Investment Trusts
MAA.PRI,Mid-America Apartment Communities Inc.,NA,,,,,,0,,
MAC,Macerich Company (The) Common Stock,$14.45,1.13,8.483%,2159876628.00,United States,1994,5752847,Consumer Services,Real Estate Investment Trusts
MAIN,Main Street Capital Corporation Common Stock,$32.96,0.31,0.949%,2184342325.00,United States,2007,350533,,
MAN,ManpowerGroup Common Stock,$95.33,0.39,0.411%,5484641672.00,United States,,187096,Technology,Professional Services
MANU,Manchester United Ltd. Class A Ordinary Shares,$15.32,-0.57,-3.587%,2496228437.00,United Kingdom,2012,113251,Consumer Services,Services-Misc. Amusement & Recreation
MAS,Masco Corporation Common Stock,$57.73,-0.29,-0.50%,15106549187.00,United States,,845812,Capital Goods,Industrial Specialties
MATX,Matson Inc. Common Stock,$67.31,0.73,1.096%,2899628307.00,United States,,94182,Consumer Services,Marine Transportation
MAV,Pioneer Municipal High Income Advantage Trust Common Shares of Beneficial Interest,$11.70,-0.03,-0.256%,279618534.00,United States,,43176,,
MAX,MediaAlpha Inc. Class A Common Stock,$43.685,1.695,4.037%,2564535963.00,,2020,90972,Finance,Property-Casualty Insurers
